{
  "contract_version": 3,
  "diagnostics": [
    {
      "code": "EP-MISSING",
      "message": "item todo://demo/followup carries no @epic",
      "provenance": {
        "commit": null,
        "line": 4,
        "path": "TODO.md",
        "remote_origin": null,
        "repo": "demo"
      },
      "related_uri": null,
      "rule_id": null,
      "severity": "warning",
      "subject_uri": "todo://demo/followup"
    },
    {
      "code": "PF-OWNER-LEGACY-ROLE",
      "message": "@owner tech-lead is a transitional DEC-007 role-slug",
      "provenance": {
        "commit": null,
        "line": 3,
        "path": "TODO.md",
        "remote_origin": null,
        "repo": "demo"
      },
      "related_uri": null,
      "rule_id": null,
      "severity": "info",
      "subject_uri": "todo://demo/benchmark-2"
    },
    {
      "code": "PF-OWNER-LEGACY-ROLE",
      "message": "@owner tech-lead is a transitional DEC-007 role-slug",
      "provenance": {
        "commit": null,
        "line": 4,
        "path": "TODO.md",
        "remote_origin": null,
        "repo": "demo"
      },
      "related_uri": null,
      "rule_id": null,
      "severity": "info",
      "subject_uri": "todo://demo/followup"
    }
  ],
  "edges": [],
  "generated_at": "2026-07-28T00:00:00Z",
  "nodes": [
    {
      "declared_status": "closed",
      "defect": null,
      "epic": null,
      "epic_classification": "missing",
      "freshness": null,
      "id": "benchmark-2",
      "kind": "operational_item",
      "node_id": "todo://demo/benchmark-2",
      "owner_ref": null,
      "owner_role": "tech-lead",
      "provenance": {
        "commit": null,
        "line": 3,
        "path": "TODO.md",
        "remote_origin": null,
        "repo": "demo"
      },
      "repo": "demo",
      "title": "Second benchmark",
      "tombstone": true,
      "trigger": null
    },
    {
      "declared_status": "open",
      "defect": null,
      "epic": null,
      "epic_classification": "missing",
      "freshness": null,
      "id": "followup",
      "kind": "operational_item",
      "node_id": "todo://demo/followup",
      "owner_ref": null,
      "owner_role": "tech-lead",
      "provenance": {
        "commit": null,
        "line": 4,
        "path": "TODO.md",
        "remote_origin": null,
        "repo": "demo"
      },
      "repo": "demo",
      "title": "Follow-up work",
      "tombstone": false,
      "trigger": null
    }
  ],
  "references": [],
  "schema_version": 3
}
