{
  "contract_version": 3,
  "diagnostics": [
    {
      "code": "EP-MISSING",
      "message": "item todo://demo/cont carries no @epic",
      "provenance": {
        "commit": null,
        "line": 3,
        "path": "TODO.md",
        "remote_origin": null,
        "repo": "demo"
      },
      "related_uri": null,
      "rule_id": null,
      "severity": "warning",
      "subject_uri": "todo://demo/cont"
    }
  ],
  "edges": [],
  "generated_at": "2026-07-28T00:00:00Z",
  "nodes": [
    {
      "declared_status": "open",
      "defect": null,
      "epic": null,
      "epic_classification": "missing",
      "freshness": null,
      "id": "cont",
      "kind": "operational_item",
      "node_id": "todo://demo/cont",
      "owner_ref": {
        "id": "andrei-shtanakov",
        "kind": "github_user",
        "raw": "github:andrei-shtanakov"
      },
      "owner_role": null,
      "provenance": {
        "commit": null,
        "line": 3,
        "path": "TODO.md",
        "remote_origin": null,
        "repo": "demo"
      },
      "raw": {
        "id": "cont",
        "owner": "github:andrei-shtanakov"
      },
      "repo": "demo",
      "title": "Continuation tag is invisible",
      "tombstone": false,
      "trigger": null
    }
  ],
  "references": [],
  "schema_version": 3
}
